<!ELEMENT benchmark ((rundefinition | option | propertyfile | sourcefiles | requiredfiles | resultfiles | require )*, columns?)>
<!ELEMENT rundefinition (sourcefiles | option | propertyfile)*>

<!ELEMENT sourcefiles (include | includesfile | exclude | option | propertyfile)*>
<!ELEMENT include (#PCDATA)>
<!ELEMENT includesfile (#PCDATA)>
<!ELEMENT exclude (#PCDATA)>
<!ELEMENT append (#PCDATA)>

<!ELEMENT requiredfiles (#PCDATA)>
<!ELEMENT resultfiles (#PCDATA)>
<!ELEMENT require>

<!ELEMENT option (#PCDATA)>
<!ELEMENT propertyfile (#PCDATA)>
<!ELEMENT columns (column*)>
<!ELEMENT column (#PCDATA)>

<!ATTLIST benchmark tool CDATA #REQUIRED>
<!ATTLIST benchmark memlimit CDATA #IMPLIED>
<!ATTLIST benchmark timelimit CDATA #IMPLIED>
<!ATTLIST benchmark hardtimelimit CDATA #IMPLIED>
<!ATTLIST benchmark cpuCores CDATA #IMPLIED>
<!ATTLIST benchmark threads CDATA #IMPLIED>

<!ATTLIST sourcefiles name CDATA #IMPLIED>

<!ATTLIST require cpuModel CDATA #IMPLIED>
<!ATTLIST require cpuCores CDATA "1">
<!ATTLIST require memory   CDATA "1">

<!ATTLIST test name CDATA #IMPLIED>
<!ATTLIST option name CDATA #REQUIRED>
<!ATTLIST column title CDATA #IMPLIED
                 numberOfDigits CDATA #IMPLIED>
