<?xml version="1.0"?>
<!DOCTYPE benchmark SYSTEM "benchmark.dtd">
<benchmark tool="cpachecker" timelimit="240" memlimit="5000">

  <rundefinition>
    <sourcefiles>
      <includesfile>../programs/benchmarks/BitVectors.set</includesfile>
      <option name="-32"/>
    </sourcefiles>
    <option name="-noout"/>
    <option name="-spec">sv-comp</option>
    <option name="-predicateAnalysis"/>
    <option name="-heap">2500M</option>
    <option name="-setprop">limits.time.cpu=3min</option>
    <option name="-setprop">cpa.predicate.solver=MATHSAT5</option>
    <option name="-setprop">cpa.predicate.ignoreCasts=false</option>
    <option name="-setprop">cpa.predicate.replaceBitvectorWithRationalAndFunctionTheory=false</option>
  </rundefinition>

  <columns>
    <column title="total">time for CPAchecker</column>
    <column title="cpa time">time for CPA algorithm</column>
  </columns>
</benchmark>
