<?xml version="1.0"?>
<!DOCTYPE benchmark SYSTEM "benchmark.dtd">
<benchmark tool="cpachecker" timelimit="60" hardtimelimit="90" memlimit="3000" cpuCores="2">

  <option name="-noout"/>
  <option name="-octagonAnalysis-refiner"/>

  <propertyfile>${sourcefile_path}/ALL.prp</propertyfile>

  <rundefinition>
	<!-- Integer Tests -->
	<sourcefiles name="ControlFlowInteger">
		<option name="-setprop">cpa.octagon.handleFloats=false</option>
        	<option name="-setprop">cpa.octagon.octagonLibrary=INT</option>
        	<include>../programs/benchmarks/ntdrivers-simplified/*_false-unreach-call*.cil.c</include>
        	<include>../programs/benchmarks/ntdrivers-simplified/*_true-unreach-call*.cil.c</include>
        	<include>../programs/benchmarks/ssh-simplified/*_false-unreach-call*.cil.c</include>
        	<include>../programs/benchmarks/ssh-simplified/*_true-unreach-call*.cil.c</include>
        	<include>../programs/benchmarks/locks/*_false-unreach-call*.c</include>
        	<include>../programs/benchmarks/locks/*_true-unreach-call*.c</include>
        	<include>../programs/benchmarks/eca/Problem0*_false-unreach-call*.c</include>
        	<include>../programs/benchmarks/eca/Problem0*_true-unreach-call*.c</include>
                <exclude>../programs/benchmarks/eca/Problem03*.c</exclude>
		<exclude>../programs/benchmarks/eca/Problem04*.c</exclude>
                <exclude>../programs/benchmarks/eca/Problem06*.c</exclude>
                <exclude>../programs/benchmarks/eca/Problem07*.c</exclude>
                <exclude>../programs/benchmarks/eca/Problem08*.c</exclude>
                <exclude>../programs/benchmarks/eca/Problem09*.c</exclude>
      	</sourcefiles>
  	<sourcefiles name="Sequentialized">
		<option name="-setprop">cpa.octagon.handleFloats=false</option>
        	<option name="-setprop">cpa.octagon.octagonLibrary=INT</option>
    		<include>../programs/benchmarks/systemc/*_false-unreach-call*.cil.c</include>
    		<include>../programs/benchmarks/systemc/*_true-unreach-call*.cil.c</include>
  	</sourcefiles>	
    	<sourcefiles name="OctagonRegression-int">
		<option name="-setprop">cpa.octagon.handleFloats=false</option>
        	<option name="-setprop">cpa.octagon.octagonLibrary=INT</option>
      		<includesfile>../programs/simple/octagon/octagon-int.set</includesfile>
    	</sourcefiles>
  	<sourcefiles>
		<option name="-setprop">cpa.octagon.handleFloats=false</option>
        	<option name="-setprop">cpa.octagon.octagonLibrary=INT</option>
		<includesfile>integration-DeviceDrivers64.set</includesfile>
      		<option name="-64"/>
    	</sourcefiles>

	<!-- Widening Tests -->
        <sourcefiles name="Loops">
		<option name="-setprop">cpa.octagon.handleFloats=false</option>
        	<option name="-setprop">cpa.octagon.octagonLibrary=INT</option>
		<includesfile>../programs/benchmarks/Loops.set</includesfile>
		<option name="-setprop">analysis.algorithm.CEGAR=false</option>
		<option name="-setprop">cpa.octagon.initialPrecisionType=STATIC_FULL</option>
		<option name="-setprop">analysis.checkCounterexamples=true</option>
		<option name="-setprop">counterexample.checker=CPACHECKER</option>
		<option name="-setprop">counterexample.checker.config=config/octagonAnalysis.properties</option>
	</sourcefiles>   
 
        <!-- Float Tests -->
        <sourcefiles name="OctagonRegression-float">
                <includesfile>../programs/simple/octagon/octagon-float.set</includesfile>
                <option name="-setprop">cpa.octagon.handleFloats=true</option>
                <option name="-setprop">cpa.octagon.octagonLibrary=FLOAT</option>
        </sourcefiles>

     </rundefinition>

  <columns>
    <column title="total">time for CPAchecker</column>
    <column title="reached">reached set</column>
  </columns>
</benchmark>
