<?xml version="1.0"?>
<!DOCTYPE benchmark SYSTEM "benchmark.dtd">

<!--
     In the future, these integration tests are meant to test smgcpa as well as 
     smgcpa with explicitCPA without any kind of abstraction.
      -->
      
<benchmark tool="cpachecker" timelimit="60" hardtimelimit="90" memlimit="3000" cpuCores="2">

  <option name="-noout"/>
  <option name="-heap">2000M</option>
  <option name="-preprocess" />
  
  <propertyfile>${sourcefile_path}/ALL.prp</propertyfile>
    
  <rundefinition>
    
    <sourcefiles name ="label">
      <option name="-smg-label"/>
      <option name="-setprop">cpa.smg.handleUnknownFunctions=assume_safe</option>
      
      <include>../programs/smg_Explicity_Test/lists/*.c</include>
    </sourcefiles>
  
    <sourcefiles name="memsafety">
      <option name="-smg"/>
      <option name="-setprop">memorysafety.config=config/smg.properties</option>
      
      <include>../programs/smg_Explicity_Test/heap-memory/*.c</include>
    </sourcefiles>
  </rundefinition>
</benchmark>
