<?xml version="1.0"?>
<!DOCTYPE benchmark SYSTEM "benchmark.dtd">
<benchmark tool="cpachecker" timelimit="1800" memlimit="2000">
  <test>
    <sourcefiles>
      <includesfile>test/test-sets/VeriSec.set</includesfile>
      <include>test/programs/linux-kernel/*.cil.c</include>
      <includesfile>test/programs/benchmarks/Concurrency.set</includesfile>
      <includesfile>test/programs/benchmarks/ControlFlowInteger.set</includesfile>
      <includesfile>test/programs/benchmarks/HeapManipulation.set</includesfile>
      <includesfile>test/programs/benchmarks/SystemC.set</includesfile>
      <includesfile>test/programs/benchmarks/DeviceDrivers.set</includesfile>
    </sourcefiles>
    <sourcefiles>
      <includesfile>test/programs/benchmarks/DeviceDrivers64.set</includesfile>
      <option name="-setprop">cpa.predicate.machineModel=Linux64</option>
    </sourcefiles>
    <option name="-noout"/>
    <option name="-predicateAnalysis-lbe"/>
    <option name="-heap">1200M</option>
  </test>
  <columns>
    <column title="total">time for CPAchecker</column>
    <column title="reached">reached set</column>
    <column title="abstractions">Number of abstractions</column>
    <column title="refinements">Number of refinements</column>
    <column title="ref time">Time for refinements</column>
    <column title="cpa time">time for CPA algorithm</column>
  </columns>
</benchmark>
