<?xml version="1.0"?>
<!DOCTYPE benchmark SYSTEM "benchmark.dtd">
<benchmark tool="cpachecker" timelimit="900" hardtimelimit="1020" memlimit="15000">
  <sourcefiles>
    <includesfile>../programs/benchmarks/ControlFlowInteger.set</includesfile>
    <includesfile>../programs/benchmarks/HeapManipulation.set</includesfile>
    <includesfile>../programs/benchmarks/Sequentialized.set</includesfile>
  </sourcefiles>

  <sourcefiles>
    <includesfile>../programs/benchmarks/DeviceDrivers64.set</includesfile>
    <option name="-64"/>
  </sourcefiles>

  <option name="-heap">12500M</option>
  <option name="-noout"></option>

  <propertyfile>../programs/benchmarks/PropertyERROR.prp</propertyfile>

  <rundefinition name="explicit-interpolation_scoped">
    <option name="-explicitAnalysis-ItpRefiner"/>
    <option name="-setprop">cpa.explicit.precision.refinement.useScopedInterpolation=true</option>
  </rundefinition>

  <rundefinition name="explicit-interpolation_unscoped">
    <option name="-explicitAnalysis-ItpRefiner"/>
    <option name="-setprop">cpa.explicit.precision.refinement.useScopedInterpolation=false</option>
  </rundefinition>


  <rundefinition name="explicit-interpolation_scoped_thres13">
    <option name="-explicitAnalysis-ItpRefiner"/>
    <option name="-setprop">CompositeCPA.cpas=cpa.location.LocationCPA,cpa.callstack.CallstackCPA,cpa.value.ValueAnalysisCPA,cpa.conditions.global.GlobalConditionsCPA,cpa.conditions.path.PathConditionsCPA</option>
    <option name="-setprop">cpa.conditions.path.condition=AssignmentsInPathCondition</option>
    <option name="-setprop">cpa.explicit.precision.path.defaultThreshold=13</option>
    <option name="-setprop">cpa.explicit.precision.refinement.useScopedInterpolation=true</option>
  </rundefinition>

  <rundefinition name="explicit-interpolation_unscoped_thres13">
    <option name="-explicitAnalysis-ItpRefiner"/>
    <option name="-setprop">CompositeCPA.cpas=cpa.location.LocationCPA,cpa.callstack.CallstackCPA,cpa.value.ValueAnalysisCPA,cpa.conditions.global.GlobalConditionsCPA,cpa.conditions.path.PathConditionsCPA</option>
    <option name="-setprop">cpa.conditions.path.condition=AssignmentsInPathCondition</option>
    <option name="-setprop">cpa.explicit.precision.path.defaultThreshold=13</option>
    <option name="-setprop">cpa.explicit.precision.refinement.useScopedInterpolation=false</option>
  </rundefinition>


  <rundefinition name="explicit-interpolation_scoped_thres13_abelf">
    <option name="-explicitAnalysis-ItpRefiner-ABElf"/>
    <option name="-setprop">CompositeCPA.cpas=cpa.location.LocationCPA,cpa.callstack.CallstackCPA,cpa.value.ValueAnalysisCPA,cpa.predicate.PredicateCPA,cpa.conditions.global.GlobalConditionsCPA,cpa.conditions.path.PathConditionsCPA</option>    
    <option name="-setprop">cpa.conditions.path.condition=AssignmentsInPathCondition</option>
    <option name="-setprop">cpa.explicit.precision.path.defaultThreshold=13</option>
    <option name="-setprop">cpa.explicit.precision.refinement.useScopedInterpolation=true</option>
  </rundefinition>

  <columns>
    <column title="#refs">Number of refinements:</column>
    <column title="#expRefs">number of explicit-interpolation-based refinements:</column>
    <column title="#intpols">number of explicit-interpolations:</column>
    <column title="#elemsInErrPath">total number of elements in error paths:</column>
    <column title="elemsChecked">percentage of elements checked:</column>
    <column title="maxTimeSingleIntpol">max. time for singe interpolation:</column>
    <column title="totalTimeIntpol">total time for interpolation:</column>
  </columns>
</benchmark>

