<?xml version="1.0"?>
<!DOCTYPE benchmark SYSTEM "benchmark.dtd">
<benchmark tool="cpachecker" timelimit="900" memlimit="15000">

  <test name="predicateAnalysis-abm">
    <sourcefiles>
      <includesfile>test/programs/benchmarks/Concurrency.set</includesfile>
      <includesfile>test/programs/benchmarks/ControlFlowInteger.set</includesfile>
      <includesfile>test/programs/benchmarks/HeapManipulation.set</includesfile>
      <includesfile>test/programs/benchmarks/SystemC.set</includesfile>
      <option name="-sv-comp12-abm"/>
    </sourcefiles>
    <sourcefiles>
      <includesfile>test/programs/benchmarks/DeviceDrivers.set</includesfile>
      <option name="-sv-comp12-abm-funpoint"/>
    </sourcefiles>
    <sourcefiles>
      <includesfile>test/programs/benchmarks/DeviceDrivers64.set</includesfile>
      <option name="-setprop">cpa.predicate.machineModel=Linux64</option>
      <option name="-sv-comp12-abm"/>
    </sourcefiles>    
    <option name="-heap">12500m</option>
  </test>

  <columns>
    <column title="total">time for CPAchecker</column>
    <column title="cpa time">time for CPA algorithm</column>
  </columns>
</benchmark>
