<?xml version="1.0"?>
<!DOCTYPE benchmark SYSTEM "benchmark.dtd">
<benchmark tool="cbmc" timelimit="900" memlimit="12000">
  <test>
    <sourcefiles>test/programs/*-simplified/*.cil.c</sourcefiles>
    <sourcefiles>test/programs/systemc/[bk]*.cil.c</sourcefiles>
    <sourcefiles>test/programs/systemc/mem_slave_tlm.1.cil.c</sourcefiles>
    <sourcefiles>test/programs/systemc/pc_sfifo_?.cil.c</sourcefiles>
    <sourcefiles>test/programs/systemc/token_ring.0[12].cil.c</sourcefiles>
    <sourcefiles>test/programs/systemc/toy?_BUG.cil.c</sourcefiles>
    <sourcefiles>test/programs/systemc/transmitter*.cil.c</sourcefiles>
    <options>
      <option name="--32"/>
      <option name="--error-label">ERROR</option>
      <option name="--unwind">10</option>
      <option name="--xml-ui"/>
    </options>
  </test>
</benchmark>
