<?xml version="1.0"?>
<!DOCTYPE benchmark SYSTEM "benchmark.dtd">
<benchmark tool="cpachecker" timelimit="900" memlimit="15000">

  <option name="-noout"/>
  <option name="-spec">test/config/automata/sv-comp.spc</option>
  <option name="-setprop">parser.ignoreCasts=true</option>

  <test name="predicateAnalysis">
    <sourcefiles>
      <includesfile>test/programs/benchmarks/Concurrency.set</includesfile>
      <includesfile>test/programs/benchmarks/ControlFlowInteger.set</includesfile>
      <includesfile>test/programs/benchmarks/DeviceDrivers.set</includesfile>
      <includesfile>test/programs/benchmarks/HeapManipulation.set</includesfile>
      <includesfile>test/programs/benchmarks/SystemC.set</includesfile>
    </sourcefiles>
    <sourcefiles>
      <includesfile>test/programs/benchmarks/DeviceDrivers64.set</includesfile>
      <option name="-setprop">cpa.predicate.machineModel=64-Linux</option>
    </sourcefiles>
    <option name="-predicateAnalysis"/>
    <option name="-heap">12000m</option>
  </test>

  <columns>
    <column title="total">time for CPAchecker</column>
    <column title="cpa time">time for CPA algorithm</column>
  </columns>
</benchmark>
